Текст;Время и автор публикации
Amazon готовит ответ ИИ-чипам Nvidia: что известно;25 ноября 2024
Геймеры в шоке: Pokemon Go «тайно» обучила ИИ-карту с помощью игроков;20 ноября 2024
Мощнее GPT-4o: представлена нейросеть Pixtral Large c поисковиком,;21 ноября 2024
Уничтожат ли нейросети Голливуд: ответ Бена Аффлека;19 ноября 2024
Новогодняя реклама Coca-Cola разочаровала зрителей: в чем дело;17 ноября 2024
Ученые предупредили о приближении «конца света в сфере данных»: в чем дело;16 ноября 2024
Кто лучше пишет стихотворения: Шекспир или ChatGPT;15 ноября 2024
В Великобритании запустили нейробабушку;15 ноября 2024
Почему российские банки столкнулись с проблемами развития ИИ: ответ эксперта;15 ноября 2024
